[
  {
    "id": "kea-weather-station-chennai",
    "name": "KeaCam — Chennai weather-station webcams",
    "description": "KeaWeather publishes three outdoor views (West, South-East and North-East). Its About Us page says still images upload every 3–5 minutes. This entry opens the publisher's page only; the app does not copy, embed, proxy or record the images.",
    "publisher_name": "KeaWeather / KWS Chennai",
    "publisher_url": "https://kwschennai.com/",
    "source_page_url": "https://kwschennai.com/keacam.htm",
    "city": "Chennai",
    "area": "Nungambakkam weather station",
    "category": "weather",
    "viewing_method": "official-link",
    "authorization": {
      "status": "approved",
      "authorization_type": "publisher-public-page",
      "reuse_scope": "link-only",
      "evidence_reference": "https://kwschennai.com/keacam.htm",
      "terms_review_note": "Reviewed 2026-10-12: the publisher intentionally displays its own public KeaCam page with three outdoor webcam views, and its About Us page describes the publisher-installed camera. This listing contains metadata and an outbound link only; no imagery is copied, embedded, cached, proxied, or recorded. No separate media licence/terms page was located, so approval is limited to linking to the canonical public page and must be suspended if the publisher objects or the page terms change.",
      "reviewer": "maintainer"
    },
    "attribution": "KeaWeather / KWS Chennai — open the publisher's official KeaCam page.",
    "removal_contact_url": "https://kwschennai.com/about.htm",
    "status": "approved",
    "verified_at": "2026-10-12",
    "review_due_at": "2026-11-12"
  },
  {
    "id": "aqi-camera-new-delhi",
    "name": "AQI Camera — New Delhi public city view",
    "description": "AQI.in's public AQI Camera page presents a New Delhi city live-view/camera experience alongside air-quality and weather information. Availability and player presentation may vary; open the publisher's page. This listing links only and does not embed, copy, cache, proxy or record media.",
    "publisher_name": "AQI.in",
    "publisher_url": "https://www.aqi.in/",
    "source_page_url": "https://www.aqi.in/in/aqi-camera",
    "city": "New Delhi",
    "area": "City view / air-quality weather context",
    "category": "environment",
    "viewing_method": "official-link",
    "authorization": {
      "status": "approved",
      "authorization_type": "publisher-public-page",
      "reuse_scope": "link-only",
      "evidence_reference": "https://www.aqi.in/in/aqi-camera",
      "terms_review_note": "Reviewed 2026-10-12: AQI.in's own public HTTPS page is explicitly titled 'AQI Camera – City Live Streaming Video of Air Quality & Weather' and presents a New Delhi panel. The listing links only to this canonical page; it does not extract/iframe the media, copy images, proxy, cache or record video. No separate media reuse permission was established, so approval is link-only and subject to suspension if the publisher objects or terms change.",
      "reviewer": "maintainer"
    },
    "attribution": "AQI.in — open the publisher's official AQI Camera page.",
    "removal_contact_url": "https://www.aqi.in/",
    "status": "approved",
    "verified_at": "2026-10-12",
    "review_due_at": "2026-11-12"
  },
  {
    "id": "mumbadevi-mandir-mumbai-live-darshan",
    "name": "Shree Mumbadevi Mandir — Live Darshan",
    "description": "The temple's official website offers three Live Darshan views; streams may show as paused outside their active schedule. This listing opens the temple's canonical page only and does not embed, copy, proxy, cache or record video.",
    "publisher_name": "Shree Mumbadevi Mandir Charities",
    "publisher_url": "https://mumbadevi.org.in/",
    "source_page_url": "https://mumbadevi.org.in/",
    "city": "Mumbai",
    "area": "Zaveri Bazaar",
    "category": "public-venue",
    "viewing_method": "official-link",
    "authorization": {
      "status": "approved",
      "authorization_type": "publisher-public-page",
      "reuse_scope": "link-only",
      "evidence_reference": "https://mumbadevi.org.in/",
      "terms_review_note": "Reviewed 2026-10-12: the temple's own public HTTPS home page explicitly offers online darshan/live streaming and lists its darshan views, reporting paused availability when streams are inactive. The catalog entry links only to that canonical publisher page; no media is copied, embedded, proxied, cached or recorded. No separate media-reuse terms were located, so approval is limited to ordinary linking and must be suspended if the operator objects or terms change.",
      "reviewer": "maintainer"
    },
    "attribution": "Shree Mumbadevi Mandir Charities — open the official temple page for Live Darshan.",
    "removal_contact_url": "https://mumbadevi.org.in/",
    "status": "approved",
    "verified_at": "2026-10-12",
    "review_due_at": "2026-11-12"
  },
  {
    "id": "shirdi-saibaba-official-live-darshan",
    "name": "Shree Saibaba Samadhi Mandir — Official Live Darshan",
    "description": "The Trust's official website provides the real-time official Live Darshan entry for Shirdi's Samadhi Mandir. Use the publisher's own page; availability is controlled by the Trust. This listing does not embed, copy, cache, proxy or record video.",
    "publisher_name": "Shree Saibaba Sansthan Trust, Shirdi",
    "publisher_url": "https://www.sai.org.in/en",
    "source_page_url": "https://www.sai.org.in/en",
    "city": "Shirdi",
    "area": "Samadhi Mandir",
    "category": "public-venue",
    "viewing_method": "official-link",
    "authorization": {
      "status": "approved",
      "authorization_type": "publisher-public-page",
      "reuse_scope": "link-only",
      "evidence_reference": "https://www.sai.org.in/en",
      "terms_review_note": "Reviewed 2026-10-12: the Trust's official HTTPS site expressly provides a 'Real Time Official Live Darshan' link and warns users against unauthorized third-party streams. This catalog entry links only to the Trust's canonical page; no media is embedded, extracted, copied, proxied, cached or recorded. Approval is limited to an outbound link; suspend if the Trust objects or its page/terms change.",
      "reviewer": "maintainer"
    },
    "attribution": "Shree Saibaba Sansthan Trust, Shirdi — use the official Live Darshan link.",
    "removal_contact_url": "https://www.sai.org.in/en",
    "status": "approved",
    "verified_at": "2026-10-12",
    "review_due_at": "2026-11-12"
  },
  {
    "id": "iskcon-delhi-official-live-darshan",
    "name": "ISKCON Delhi — Live Darshan",
    "description": "ISKCON Delhi's official Live Darshan page publishes viewing time windows and a live-view player. Availability follows the temple's displayed schedule. This directory opens the source page only and does not embed, copy, cache, proxy or record its media.",
    "publisher_name": "ISKCON Delhi",
    "publisher_url": "https://www.iskcondelhi.com/",
    "source_page_url": "https://www.iskcondelhi.com/live-darshan/",
    "city": "New Delhi",
    "area": "Hare Krishna Hills, East of Kailash",
    "category": "public-venue",
    "viewing_method": "official-link",
    "authorization": {
      "status": "approved",
      "authorization_type": "publisher-public-page",
      "reuse_scope": "link-only",
      "evidence_reference": "https://www.iskcondelhi.com/live-darshan/",
      "terms_review_note": "Reviewed 2026-10-12: the official ISKCON Delhi HTTPS Live Darshan page has a 'View Live' entry, a player/iframe, and published viewing time windows. This directory links only to that canonical source page and does not embed, extract, copy, proxy, cache or record the stream. Approval is limited to ordinary linking; suspend if the publisher objects or source terms change.",
      "reviewer": "maintainer"
    },
    "attribution": "ISKCON Delhi — open the temple's official Live Darshan page.",
    "removal_contact_url": "https://www.iskcondelhi.com/contact-us/",
    "status": "approved",
    "verified_at": "2026-10-12",
    "review_due_at": "2026-11-12"
  },
  {
    "id": "vitthal-rukmini-pandharpur-live-darshan",
    "name": "Shri Vitthal Rukmini Temple — Live Darshan",
    "description": "The temple's official Live Darshan page describes its public live stream for devotees. Stream availability is controlled by the temple. This listing links to the publisher's page only and does not embed, copy, cache, proxy or record video.",
    "publisher_name": "Shri Vitthal Rukmini Mandir Samiti, Pandharpur",
    "publisher_url": "https://vitthalrukminimandir.org/",
    "source_page_url": "https://vitthalrukminimandir.org/live_darshan.php",
    "city": "Pandharpur",
    "area": "Shri Vitthal Rukmini Mandir",
    "category": "public-venue",
    "viewing_method": "official-link",
    "authorization": {
      "status": "approved",
      "authorization_type": "publisher-public-page",
      "reuse_scope": "link-only",
      "evidence_reference": "https://vitthalrukminimandir.org/live_darshan.php",
      "terms_review_note": "Reviewed 2026-10-12: the temple operator's official HTTPS Live Darshan page labels the player 'Shri Vitthal Rukmini Temple Live Darshan' and explicitly describes the public stream. This catalog entry links only to the canonical publisher page; no stream is embedded, extracted, copied, proxied, cached or recorded. Approval is limited to ordinary linking; suspend if the operator objects or page terms change.",
      "reviewer": "maintainer"
    },
    "attribution": "Shri Vitthal Rukmini Mandir Samiti, Pandharpur — open the official Live Darshan page.",
    "removal_contact_url": "https://vitthalrukminimandir.org/contactinfo.php",
    "status": "approved",
    "verified_at": "2026-10-12",
    "review_due_at": "2026-11-12"
  },
  {
    "id": "vaishno-devi-shrine-board-live-darshan",
    "name": "Shri Mata Vaishno Devi Shrine Board — Live Aarti / Darshan",